{
  "schema_version": "0.1.0-draft",
  "task_id": "123e4567-e89b-42d3-a456-426614174000",
  "session_id": "123e4567-e89b-42d3-a456-426614174001",
  "request_id": "123e4567-e89b-42d3-a456-426614174002",
  "created_at": "2026-10-31T00:00:00Z",
  "updated_at": "2026-10-31T00:00:00Z",
  "state": "queued",
  "origin": {
    "kind": "local",
    "display_label": "This device"
  },
  "user_request": "Show available disk space",
  "intent": {
    "category": "system_info",
    "summary": "Read-only disk capacity query"
  },
  "plan_id": null,
  "current_step_id": null,
  "result_ref": null,
  "error": null,
  "version": 1
}
